{
  "schema_version": 1,
  "pattern_format": "opaque-hash-v1",
  "pattern_id": "OPR-7C9E2A31",
  "identity_stored": false,
  "source_code_stored": false,
  "disclosure_policy": "deny",
  "public_salt": "cdf9c81fd70d67d60c7f497cbe55c071",
  "token_hashes": [
    "049179dbd487653c5df9534633a07b986f505844ba9d6e752190c1c3fe280f5b",
    "09c7e9e35f6daa49cde15438e0931a06c3d7eea5ec813d08a151d411806c96f2",
    "0a46899efaef51b74fcb2f2bf0a9277a30f06a6ead28db1c1904f16cd46b9e0b",
    "0d9b2acec6188d80b5572fff47e3f3893b5b512094f99b446625059695f6ae80",
    "1083ce9c0c179f418774652108a6dfc779f2362e095a015e6123ce38d4642b18",
    "10b0c2ab9b806c881c9fc3d95ada2ef9b4c7aff88c07d8b55c1afbdc8a63b8ae",
    "130c2a2a2731903796cca80f955c31bc1b49cb2c2e048d059d668a5ef33e5114",
    "1881d8b3bf3ae9a3dd31842d6c2eadc26a8a613ebc292fff98d2fa899bfd0475",
    "18ba022540d8d3bf824a3dffdc7580ac19999d25550ccdda06f4dc23c83e13af",
    "206b24522293f9f71644a4f0144432a406b6c5f1a415e22d84d04d9447e9ac71",
    "263feccec63e42fa6d2a1dbae19c338b0e63d044fc2fd6d1e3bc22a8e372d4dd",
    "2743f4c75b93b4a66cb4da20343bd116896d6e7b78e3acfe1f72bfda8579d951",
    "2a35932e3afae7f70d29d3b196bcaf1715a7ac56270fa9dfeec3b230e7537e91",
    "2c02b3ac61f7e6211409d512fa9d6881212012ceea60aba4d677a860dd53f592",
    "2dd0c01e315d313e665d3580f6a1da9a28dd8fbb79590b598e4c49b71b166dc0",
    "2ecf731b7f1208c2db93701c52ca2ea34dcfae53bb1ebf9ca7133c0dcbaf9f73",
    "2f8bdd4f5525387ad311e351fcc8b4882cc917b117cdbfd97d519ec6db838869",
    "334964955771b5441033635bcdbc6a44bc0197e08566e6012943395b683d6b07",
    "36b786d95e4da3ecbede57d595e62c2bae78162796c46f2eb853f45568bb23ea",
    "398498e176d98383dbea139a56edf3c7a791febbdf9e8c4bceb35a31bbe7bf24",
    "3c7ba378f832ed82d9fc2771c7573b791bb8160ed36dae63aa8f63b655c51449",
    "3ff88226e4d5a4620420424aa994e33865fdf41287ad6724e5aa2e292bff87c8",
    "40d073fcc7f1302ced57f89647f86509cbd64d9e74b98ff7e8e89c03101db022",
    "42352c6ebe35e8f4dc0d0e1a6603246dd306a423ce8e1122cd86f948c61fbde6",
    "426bb920ada016aa809624d3923b02ad8c6b7c5ad75d514481d3349a011776c1",
    "4477e716050ab60da884652ae53fcdb8cff93711e0f60193b52541bc6a135e76",
    "488697a73e2fcdddf44e53a25ee8f7e542662ddf649453e5fdc99f31b94c117c",
    "4890bd4c1f16173f18bdee4414cd270093e4f6f21818f7e2ee186902c3cc5e0a",
    "490ab9c9f28600b90369374ffcc3af3095f84742d2c49b5c61ffc1930f350541",
    "4cfd3903a77e6cb4a093923dbb9661edc4ddeda8ae29f580f1f2ec0d796b898f",
    "4d50e75bb172ef556169be1c01f15d12804f73e9949dab6b2f82abe189ab80dd",
    "52e64f668c9c2a5d4009ff7fc81a380444e548d2a3b1bd60d61871ff14fc45db",
    "5629c29f6023106542a4d376779cd1c64e726995df977a362236e1ab09faf596",
    "566502a19a82421176c768283d866bbdc81ae0e5bcd57bd5e5ee4e1a22cf678c",
    "567ce470c010de795aee23e155c30e6be9b98799e03f049f1adf6940cc31f6c5",
    "596b6ba2613443d5a880aa80a5661f0f09839a0fd9d389c3f4346b0a6295813d",
    "5cee0fa64656859a930d2bf7916e668c2305c2ac430c68e2efa2f6da1829331b",
    "5cff30ab1397aae75231daa8e4cf9192a9923098bb5fe6c97cec234339a02c31",
    "5d9aa18b19c3693085b88814b6148c48cf954047bbb09551092a4bbde53f2dd0",
    "6268e3be2a3efd8e0d257f16f40b888bc09910b810f24685977e17ffe7e0d103",
    "6da6c63fe27dfcd10406bb8e2dfaef45b2ca7d1ccd35b3f16fbd3c03b6f1b542",
    "6e530f4352c59e6edf781c0f27f11b98462679bd5080b5faf9751baace50d535",
    "706d61b128063540bdfaa7dbb071d8fae854c60f6d79ba4e15fb675fafc8ff5d",
    "73f36c6f3a8158bf4957c12e9be502221f4861c180415ae1a26fc091ece5b9d7",
    "76737d8ffc38fd0a393e7f9cd888bd7944a84eebfa3abc54adfdd31abc885bff",
    "784fb382e2d73ce100854d86f390aff954488310469fb4cf2154467db76c7910",
    "7e98d43631b6b90af7a011958186231486e5fde50a0aea8edca3ec944a3ae464",
    "82d50853d2e768554beb5a562b140d4956b556f858fc5c5ea34aa3ef4665ffe6",
    "83aa6260cacb2f7dd92278edd898ba229f00d9014a6c92e4e48ff6b46270af3f",
    "86c10f6d3a9ad8d125be2f3575b0dc5b414ea184ce5a4b62b2c6226846615fdf",
    "891f77a3b92072f12c22ff33016b5a8629fe73dcdba9d22db98d08ad35fcb1da",
    "8be5d9f008cba005e243da8cb7ced41ca85c13387f43a7d1c7ff0029d767b4d8",
    "8c66cd2212a892765a52c378bb6577e7d2fbd19be4b570e33a862a74ae503394",
    "8c980ba9d7a654070c072ba40e36ea585d9017cf07274b749f8f91b4abc55acd",
    "8daef9858ba42f51dbaf3b1e79e8f6f334698d3c3f26ed28a47512f5a7b2cd91",
    "90b203552d966e16d18dc83c34f092d7fc44c852712c7cd13e3958a34aa6bec9",
    "9620a721e8e2e2e6d79e1b851cd140b85ecd5417aae1a52d5c0629b0182e0f46",
    "962ac04d688c139b14afbb3c76415c89d052edd5f39abb91d679b3cb291f3988",
    "9af47210109903b2689a146d4f30eed469f9f4f0b53b0844ee250c8ea1735aac",
    "9afb53154f745089b57f482783fbf526ea6adb1d49d3b82d0b6b84de58bf72f6",
    "9e7edd53b98c1dceea4096f1a40e39dd69290148dacb4689518c159f65dbdcb3",
    "9fabc3f4d3a8ee07de6c7a16f0e517aad6ca0a04f39cdc86fe0291ffb406965d",
    "a1f2f86141424efa798245724df0264842ca897c14542a13ffa70a69807d1936",
    "a427877f35b26c8be2e6b0e2a90ae8dbf1abd2a019abaf774ba1d80d3c74f3cd",
    "a63ce3b3b4563ea28f9b374a01316b71a52f774b4fd97a885e3ef3fe581bfabc",
    "a6cb095425a3f29b1e0ba0ea920f150a975e04284d4e24cdab03f14b0449a19e",
    "a6f0b172e494d4f5dbba1dc5fed45d48c5b628c068964ed7ea8f5a4869a2ef50",
    "a8675e518b9092a978f8a93855d92d269127343eaefb0f173a73d82390acd587",
    "ad936d02266b03594e5c6015868689cf5ed5aed931f195a5dff00f91fbcfd897",
    "aeb2ff579330604cd3041c20709b34e4c983332f2b7641db11bf10a4875a1831",
    "b27e74fd06edabef405cac25c098b3203e17efefbec7c214e3f8621cf6a84444",
    "b306136e9913b2af56d6d81c950034b85fe2c323f33cd2cbc25f4898e4c34e93",
    "b3c1fdef3390e10c9606faeef2235c9cd849fc5c8470d4a093c7e889fcc23b63",
    "b3c4a2803de7b63317cdc56148eba0835c97284af24d17b2e2b2c7e6bb9c36c0",
    "b6a4b3c735162b3f48f88d77ebd06d00785c6b4d6fdba07e7b6d6847eaf4fbc2",
    "be0ad49ebf3156c20250829c67c1affb631b70c18b6de32c7eba615f114d20b0",
    "c4276808eff88e6b2320ca00c253cd1cc3f62192e5425bdcd7e6e5a5facea1e5",
    "c579aea34037c1f8b05459f4109999e8c820039f1fff1f97cc2ff75db73a97bd",
    "c80857aad8b6dd7d0d0337b9f9d09b6685bd35964dbdec80bf58abed4e2954cc",
    "cc4a690d03b02bcd24ece75b2d2dedb2f0cddbf409255c803645d81bef2228c2",
    "d03c074398263cd80dc093d9d98357b8ae380141ebd8f598358f62d82f5df6bc",
    "d43f7c41ac75d06f963130b5960633d232949f73d366b3fb07825c148230b69d",
    "d71330f0dc477f4ab65f8c5d8393426e19931e38e881bad59e962408d81e4471",
    "d8a90931f312dbda2358c43393491eb23b448e6013fde5e45fac872ef58a5035",
    "de8238622e366637a22577ca0e7f85939792a24e880c7979451c37d0147b5c1a",
    "e766a9cff307562742d0c62c26bcfa5ee0f305909ad7bbc0db755b94375df6e3",
    "ec60345fa3cc895911752ef806261bbcd097a04a4ba0939375a2d76652613e07",
    "eef2b7b2110f5045cba7b2cff012a4ec1301128a590ab4b614c09a03288a1cf0",
    "f086f8e848347bef394b37b3aa7293fcad20c53e7e5935d36aaa62e74c9f811e",
    "f10bb2b088c58cab93e2a0cd485c54437d46fac85f9b7fb7a7ef4eb5bafc6290",
    "f5ca1aa9d18ed0507359c3723c56547a8b2c582e1854749a32d5b8b091a8f635",
    "f80ba68a7457c36aa5e137d892ccb2d299ea53bf87acc58cb229b1be99dceb3e",
    "f8850ffb52c9feeffdd034a15a01cd390b1fed5e24fed143b181c2c96023be08",
    "f91e7cf0e719b862a20b4d8db195c90a2e1cdb834938719173304284938be3c6",
    "fac23572f8e9e38eeebefac8b5c143be74583c5618d6d1241936d50745d3bcf7",
    "fdb02eb3b5779d25a732070a6d8dfdddbbef02543b62375083b986b5108d1cda"
  ],
  "shape_hashes": [
    "1a5f2c8548c5e8e36cb4528826409e207996586c3047d3ef444c3069b2d37315",
    "22bcb623abd7613b366c780358bce0a5dd954037095efe050d3f89bbe0a023e0",
    "2c51cabc39e8c51b91bfbcb51447a6e8391f3f1f2f91c06a5840ac62e6ba89bf",
    "356430ff198b4d2f416e1ca1601ce986c971d942151ddb691d5e6f28331c2b5a",
    "5d03dd042f4c3c5edcef2468361254b374cda8292a8df4c4498f56cdc9083623",
    "673dde832188d70ea62cb772d70ae7d5a36ce0bee4c598fd208762583127959a",
    "71e86ac42388f7186ce725384a7c7fc62d05f1d6072f5cbfcdbde238f4b0277d",
    "86eb678864ba4a9f12e44e62856b350bd07e9f90bc43d7bcd88946d65e18ab8b",
    "af63ce7e6c281a717f3ffb5ff4d49149ffb2ae3ee7d975ea67b117ee2a9dc56d",
    "b1b644f0e5809329b3c0cc3e2e20eab2c1a220dd2f7abf2a2a4d81f0e8c18af8",
    "be69f84174f0be6a54300bdc28ffec40e3b94b3f914df01b4b762b5d0ba91d25",
    "e763dde360b8be3ae19db4fb3a8fdc92201566c4b08d137d064272f9cbfed8c0"
  ],
  "thresholds": {
    "high": 0.55,
    "medium": 0.3
  },
  "safe_assistance_rules": [
    "preserve_existing_state_ownership",
    "inspect_related_user_code_before_creating_duplicate_managers",
    "keep_project_identity_out_of_responses"
  ]
}
