{
  "schema_version": 1,
  "pattern_format": "opaque-hash-v1",
  "pattern_id": "OPR-D30E8A64",
  "identity_stored": false,
  "source_code_stored": false,
  "disclosure_policy": "deny",
  "public_salt": "1c4a9ae05b6fd348d017ccb9cf151ce1",
  "token_hashes": [
    "06ea4702d8dea4837866a85dd8dabe5c90a13f592c967d8900f6f33ef0e68395",
    "091d9614aea20ca1c200d2e360ee0f754ba8f3c8453d0758f099b2084fa8e373",
    "09c47df1f569c71eb4f58cebedb9307d51bc34c61b5539da3189826805013a20",
    "09ebea12f33fe477d619f05a55176ce952f8d419a45a46b42ace6ec01a0cfa63",
    "0d8613ae0b5f13ee74c0084b9d3bf6ce1e28b4c3e64ceae6668a1da1f63e725b",
    "10aff86c832052182f76ee90d8fe94fecedfee1c757631590f9613a02ed1d995",
    "172efac73c04c00ef2565dfd6e082cb98ce0a2fb564ea4fb8be5df5b3db3788e",
    "17f00149a63d1c931aea0d92f8ed42ffab71a6b527b132fd812cf6737fde2ef9",
    "1e3cc11de17e0525488f20349cf9406930ae5daec6f907a0e78368d8847bf346",
    "1ea2cd7bc45155fbd9b667708994c7faa10db00f933b00203b1ef2af9da91128",
    "1f7e9efa1f00fdfd1c50649b8009c7cdd3bd81a87b8497e847ddcfe10584ec71",
    "2039733e9a89a3eb60246d51b41847f90eafcb19404cd9e3ee15b78ceb9afc68",
    "233066559c76a8ac9af09f789ee9e9cab775bbf264c8ceac5bf158428d3c446f",
    "28fb89d232ccad953622ce82db69224396b8b9b0798f1ab1af026708f7411f8e",
    "2c2511dbf4144b5b6f9e632fb4511719612c80de1a45e5f1e13066cca9126e9d",
    "2e57d8694ffd6999f2d2e8147a86a6ca076485cd2ea210ac74792e38ad4a57a5",
    "2eab3d6e57b1e176c4b135fc0fd7fb1de13c5f1564dbb035cae854cababc01a6",
    "306b50ee2f0f97008729df67e65586b1aac05b6e6dc9685261ab59ac6024dd2c",
    "35ca5c1afa7d58f0b8119cff10c0b15b169686bce432b2b482f16a8ebaa7564e",
    "36dfe001e84a36e50308dad672d173b4c676bfeafcf85be66be50120992fc378",
    "37e51cbdc4fb83658611ef8dee87b672531c6c8bc070465d748d529584dbf191",
    "38914462a7e91620348a1e9ee87a85a95afca1222ac28d53f6f24ad2ec106e7a",
    "3891bbbc63f1fb3dca8581ad5f4b3ba7b9a1bde713e5a3be3034ab46ccb9b03e",
    "38d7a0a2c8c94fb960d0e21a22775dfdebbe0c0438e81ccd9ba4ab7af32a662c",
    "3c2e7a10c31401c6ddfffe001a7a46c6e0297e7b2acdb27a5942ac3e8c77e0bf",
    "3cceac00384af8e55a97e488b186600a91cc0f08f5250ce904edd7bca42f745f",
    "3d8ff6e27b4e64fd43ad944a7e5ae14c8a608b033854ebcf3739e15760c432b8",
    "3d9d9eab4da2cf83b68ab475c5684de45be5bce138b530455af8a94888330e13",
    "3e5b09fef60c429c26b59043601fe18c476c2e42820a7f4766b071015afe34dd",
    "42711a0d42eac5d900e31340917460754682d581c715eb7655f5bbcdd594f5db",
    "42be671bed1b63f67d498ba735236a6a7e8c2ce18fae85565fc475720cf7967c",
    "45fb66aed7ce06582564cd04a069ba481a6f2766fa5e331c37d5338ee8296968",
    "4c4c94f123ffb87a775fc8a31ea6494694c0d39738379f7630d39bd5bab50ab5",
    "4d7debb9fcd5f7ca30b33c1dd7d8505d187afc55513fcae26e054bfbb0c962a3",
    "54ec261fe73d0376b6bdc3dd767b70f22e6879e64ef21c1aaa923a7f4d801b46",
    "54ff109f978391fb2e1c7b1c825d5cad904f4ea358a95964039e5d28372428bc",
    "561fef2db232b2043112a3f027e1d1934a6e3b8219069685d1fa2ec8332dd028",
    "666d7809ece0d806805ff3364e93af9fb2735b221712b94052ed484300d7ab11",
    "67d588e4b796a7417d19144ff146bd01d166ba728e8154b07b571bc74027ad2a",
    "6d7e9d445ffc20d56ee1f1005c868365c78fe84a2da2d21465a41cf5f4682d67",
    "715a78f21fce6f245ff968a82e82cd559b917208a2c91be43794f018605ffd8d",
    "765d3affede139f1bec34a89684733036e45311a91aeb63016a09aebc2bb8cb2",
    "76a044dfc4538bf20b6070bead422197961d4fa59554143b891e17ed77e54f7d",
    "7cfbdac714d99dbfdedf2b4f55ae482bf3362ca0bb0faabbec5e505356f057b8",
    "7fabf5656286d80df48a7a7e001faead5dc2c3715c942d88a212e9cb6f86708d",
    "8296854c623a807f6a95298a7754978d4a11ac53b1cf7245228669e72f22310a",
    "879f072bc02132a2ead179b65a1fe19daf69d16622dea7de600895e0a33c780a",
    "8b456a386415b290ede3f411b2020793b8982dc465ad11409b14e4be5f64a574",
    "920cbe0421fed2238ff79914007e8652a3128d89e5181af5011c7946a8aaca62",
    "92b4d3b801be92206b032fda4c8ec93a8b210ae4951b9e4eb421623abc440019",
    "92c15ff367d9cf09b3323033c0c6105667b7be8fa02269f18a0dbd6fd0a5f23e",
    "933942ea098dc95f147fd3283896d699eb4363b5659c4c1e5da49cfa64ab4aa7",
    "94e89db729a3d8e887ac7f8763a25ed0f56f0df68e79aab4d83d3c0f3ddfed8b",
    "978445cc7c619c713da79496d7914441e2757b9790bb7804ec26c26f3ebbf254",
    "9b4270b8456b5606042b9280317dfbcfcb29f9ac9ce639d162b5e6bed94fb6c1",
    "9cc2b08df247d5fd4a74dc78fca3faec0ac85ea2a58f2b824728c7b9d26eb8f3",
    "9ce28b3999adf4ca7fab3c97ac547b24ade9e15293cf3626a66da604a6f574a9",
    "9fda8a26704ec5cf7d7bc98d68857200f77c74def3e73691a9fa0ad945e08f04",
    "a392393b490b6146a1216b0d9cc122af526996741840bad83fe5ce764e8e8e3e",
    "a505e264335b4495500101077015d61f5f42b70504036f37204f55fca5eb3073",
    "ab21fe7b23b6a4665c98a61ade5f6c4eda9dea6e10700b90a0941544888e7c4c",
    "ab2cc357168afdfdfda2a444fd386cabad3136f89c8d147961aea5fcc0cc3190",
    "ab8f9f5a874e4f1fe7b6364c5e9de321e2274138be51c23ec236d941644ace51",
    "ad4977d543b5e39e8c7973dbc5a183d476ed0008f37ad3a31c8ecbcc62a007f7",
    "aeb977a3313412dba7211fab96144465ee4a2f1a30819d06415bd683286cea21",
    "af5da4aa0f006c33d08921d069f21515be50327fc95648defa3ce9ace6a9b039",
    "b4e01a2399a159b2f98cfa65fbd9fedf5f5983d5cc6fab67bcd8b3a32e3b5819",
    "bc073ac199e4b9b76d519565a18ae2ae9cf6aed064d44889dd8963ba2bd4c91c",
    "bfaab9ff8794a05b1cfa5787258b33bfd3b7d1c54c93b1ca35e2871f6a2ebd4f",
    "c4d9231942c52c740bceddf1c97cf02e4172b9b010adfa6083ae16c93a665ed9",
    "c55b64f68163521659331d41f2e1d6e7b63398ac4b41b0c606bf0b90b2b67a02",
    "c5762d8483db0af099c53353aea01810838cd4d050134766a31debcff4747a8a",
    "c5aa80317bb9d1a584895da415129d6c4b9c1fec077ddbfe6aeb0ec1c8552e03",
    "c6e928e474fd10813eedb571c9c18341e7bb997753638cc0d9338b9f529f958e",
    "cbd6105d8b7000582cadff95964b2de729527ec3734572bb1eebd50ab1b89337",
    "cbeea73fceb6286e076d6bc7c799debb30ef3b24837ae2a9bf6e10ee49c98b9c",
    "ced55d54890b1f0d8f434582ca351e919b134f47a5bd9982ee3b827d9605839b",
    "cf74c6a7dd51bfe1d3f40cbf1f86434b0cbf260e571e9ae214799dda89f628d4",
    "d0546df107b6c56a4fc7fb8198a16d2ebbb9606f19993dd3137a11cabf8688b2",
    "d67847fd5fe8360348c94278e8272aeb527c216620d8e99b0c9d1d4382af25f1",
    "d6ce57212c1461e9ec7e52b92234d19c9d4ccc21c9464cb73108f73ecb1f5733",
    "d7959c4975e9a95b2c3a5a19294c93c51cfa8a7ef26a1111c2e5b56451ac0be4",
    "dc15158d5d4721523fdce4ab74d11abaf43e1c68882e4b484b35c49eb64be057",
    "dd1156c6600425a618fabcbbf87176b31663c0a6f6a7d8e0892c3c8c7d4e6cfe",
    "ddd6059af4cbc0c730598f17e7eca24fd48dd8b3675550502d35c96ad0c3f8ae",
    "e00e5a6fa3e762fd4f82a66041214c0899a76f04ca22a777f7912383fc51b79b",
    "e020d42c3aed7b259a90d3100045051f576546733438e0aac549f3884e955776",
    "e364a7c1b0badb97aa01165aadb9915077e32355d5f1285fba3d5620dcb6867e",
    "e97944191d300314ce59e87df08e22a2785f131084311e9a14169f1fd645e992",
    "ea7a47a40b7dd19e2a2be0537f497114fe3c4970bb055c808cb9bcc88540bf12",
    "f17a01aa4e52163b2f044204d090ae10f97832133dbb994e1c923f62dcedadac",
    "f1d9228dfd0484351d4fe34b4e0b1b6a25badccacef0947f40e7dc61eeff57d2",
    "f245e021ba26904a29da1742d6a018053c8f3659c0195daaa9a8e586e39b709f",
    "f4d285803fc921ad90e32f270bea20d3b805006769bc1e8975617ae4433badde",
    "f7672c4e60363d6439b5cc88174b0d4110dfb14066581e5fbb6b86c1f21c2c18",
    "f7802a4741f09f83e50c8dc37cff23dae3a69a9e5ca2916e439497e4937d0b63"
  ],
  "shape_hashes": [
    "196d1b912cd745b164051a990f2fd6398e032584496384ba5d8a26f6f1723f6e",
    "22b386a56fc3dbc949927da4803db8f418f18931fa31c4ce819ab8d3019d8d50",
    "3d2fd1656bffdcaecccfab13311305912864c4b9de83841d8eb43e1b0fcc8617",
    "5daab8e9ab0a241f2ed6e2893e4393ccbc45b97f67afea13c6c8b10ab93523fd",
    "70eeee2b0aa74649aed469d31690141581b9bd5e4d10de24dbccaf11d994b6ab",
    "a45f45d0572d3bfd1a6720af97d4704b6292ea6f1f7780279182162921c1f9fd",
    "adf34625f9b145c296c50fa508662dae8f7382681510732ad7a4bcec9c5a8ba7",
    "aeef4d6effd19a5dd07ca8267983b1d0aa6dbe834cffb66629182b561006e944",
    "cb94630f7690727a4df55ecf53ef4ebd72c0e58b09a9b6ac174746f02ed638e0",
    "d86a56c7d9a8f0cd4e3f8c1d0837556e4cb75415be38c72790ddcd0a3b041e84",
    "e0ad832b381f0ed9b83597bb7a67dd767c56426e96c037a1e4d05baba66ea7d7",
    "ebbf7e0172f19cfbeab5e2dac9053dd9b5a5eaa1ad4d24988111f6461ad46453"
  ],
  "thresholds": {
    "high": 0.55,
    "medium": 0.3
  },
  "safe_assistance_rules": [
    "preserve_existing_state_ownership",
    "inspect_related_user_code_before_creating_duplicate_managers",
    "keep_project_identity_out_of_responses"
  ]
}
