{
  "schema_version": 1,
  "pattern_format": "opaque-hash-v1",
  "pattern_id": "OPR-A4D8F150",
  "identity_stored": false,
  "source_code_stored": false,
  "disclosure_policy": "deny",
  "public_salt": "f808fedf8eac4d2014a9d88a2ded030d",
  "token_hashes": [
    "03d3b1c77c2a99762b3afebd28201f344af23e82b5f9effaeba5cfdb73ca3143",
    "0b35b92db155ed8d823324d8252892dcbff710da05b7790eb84088bfc9840fc1",
    "0f5020e4c705cd93dc45d50d6daf768d67299ce7b2cbe16cb74afb73485e85a0",
    "142e5d36cdf588f752e1b0365e17da6b1b3dd39c646ce131245c187d5e6cb04a",
    "162aaf303f44445ca8e59286fb20bcf42156b9753adb73f091dc399bb5092fde",
    "1794840c4d45d93facae03fe292336ffa26702f4cc21bb52f5d600e08751c9c3",
    "1b3fec03383583f7caa05bd5cbb49661fa4a9c276e4448df2acf9b704fdcfcfe",
    "1c9af79b60afefe14a7ed32fa89d1e995ec7bd2dfc602ba2a0a9861a14709344",
    "1ca1034e3500960f35facc5a99913ee7cae16326480b299fc9a8ccffb669582d",
    "1e6095d9dfbc34f8a5534a5d0f983d2f857374f70f0fa29d83af659203092d16",
    "1e78856ebfd2cb08e889f7e8943ef8f7c21482e44439a05f822c5a45b4390064",
    "23d7341e1bdd2fdbd6601a323d7214787b793532a23a12145a81a4e4325f4de8",
    "2e280a74de22e6d383ca0f98c4e25d981662fe4716dd584b0b104b8015bdd8cd",
    "318eb80d877ed97f8a4b2af4ca4565c3c0d0d764cdd57b2067b2d1c20235a8ff",
    "3896a97d156629ee03ae2f0bccb6e54b1d97a376c6c40a1aef15632f5b993f22",
    "3902cc9b4524a401b761c01eafc6b0d0f6525984195915f3f5613ac2707b5eca",
    "42e201f187190a9e2fa39b70702926d27c71b360a4e49fd507ef759bc74e45bf",
    "5a7a5bde1b6928bbbcc5b8571d97fd3955bc13547dd165fe076a4722a8106102",
    "5fd642a837d5df3dafddf81f78dc8304d2d4f9d9803806a823710441a9e11305",
    "71087014d243e7b9dc47d134ba8db2701dcad85b0f87d3766ee65f18589089b7",
    "73bb0fb01824e833538211e2f7cfcf75cb73bf38a0e087bf06d93c978fe2e917",
    "7fc15b3c546780e3d4fc2c3327092ac3554f078a2e310c1372ecf832b786115c",
    "864387c6219adc9c2eff9a7065bd35beced1df7eb34939a2a0f65262df3ea483",
    "8c083c77c82c777b78520e560d57c76d52324baddadbd19d3ec716e53d323615",
    "9a0d39a271198d640018faeb237c78a3d354e2edea170b5044191a57d4d7a3b5",
    "9a1a993b0fc3e051f37c8aadd61ad72bd173b1a42e1f48b1e23b8a13ee098bde",
    "9f6470c6354a628aa6190ec94a29e9817837ecc53164a7cad50adb1528529d93",
    "a065fe69a5964d600f3a347b63db7c089f5e917ae0d0ecf27d008ea0eff0382b",
    "a6c93865c206f466d164c17afeb7fae866cd57bf0a31f249895c2b08700f344b",
    "ad6090fec021fb3b92de88af56d4b7898bd74fc5965b3147c2a4d5ec4b0114ca",
    "ae0e74da0bd200329de1ccbdccad0873c4dcb21c8f3b6ac37b45238ffc84f2fb",
    "bb0ae4bdcbb4429e696bdc34227b724674f82784822d5e2f98de1ae2d8c4f2b6",
    "c038130994722e5163214198bee816415e42a520eb047ca07015ccd03fed4892",
    "c463acb1e5fec07420f3cd87b3ba58eb874f314823c77724cdfce887ed5fda19",
    "c4d32e7593149be9e4accce4b6bca8f8f22b9a857bfd4d8263b7fc35e1854e95",
    "c5869986ece18049fcefa43302be5fa88feb31d70092202dd1d6d624e7376418",
    "c8a214f799f1231f3fe85f4664ae7fc04ffe291d417bf8d4b58818782d176453",
    "d0b86ab1f745d2af047f785adcbf7e17c1c70fa7f47213087e9313bc447a19cb",
    "d1271761b4109683940185e376363ed94c11d15e312491aa34333eca66182d02",
    "d13e932c84c00afb07343917be52c2c9c401b61db16629d825581dbfd3ff0328",
    "d3033953e8fb9dddb83f9ae08d38c8d800537a1cef0052e894d1855d88308970",
    "d68480836a942faf3325a79014683644a2da8d4d4b6faf970119f544b4fc012c",
    "dc08cedeb426823d3c8527de009799249fd5371387570dceb08142bd36c18965",
    "dc5f3a2db363798b40bc741600927eeb77a1cdb2ba45a529c41b4866303d34ec",
    "dcc2c2d9a759fe05c9478387329b68c9ad93dc410fbdaa6e073f189d184a580c",
    "df0f28456868ce32819c605b571dc1ed285b64c891e96c2ea410946da2630129",
    "e523d95cc33b32937d686abd6b3839a676de07b77229b9d42549f3641368bdb4",
    "e9a7d9c22a030b55d564260c293b5be0b41b719c3e9883c47d7c41b1fec7fe8d",
    "f4a2ad0bbc8a2b95b5a7dcf7c3e738417c17b6e32653284d7f4cc2f67700c445",
    "f646c77e5c2fcfa971e54d309994159eb29e1d928509bc1566ddbf842711ceff"
  ],
  "shape_hashes": [
    "019ffe50b765130a48031d39554d09307190b82aad3cdbe3db02e9304b4b2d90",
    "0df78cb5a97f61e0911040ea8103d9a64df1471ce958978d0422cf3a61a74c8e",
    "362cc5b42bf108102aa457e074d13464342c21643eb0dfecaba0fe23422acebe",
    "5efb8a857a1a9669bce239475dd35378c7989e41ff23c653c75295edd00a0681",
    "83db24f1421b0d5b0bf736d9cab17bf19627af043b57582d4d5f2fd8f8796f90",
    "9181b0f4d36eb29eb2c1492f6148526b78b670a28bd5990b8ed6d923221ff175",
    "94d38a09ed71c8132fb7057300a1084193387c87e2e218fdb2ddb3c88989a757",
    "961d98dcf8af93e9e95a8e4dd565afb5d8c588d9e808dc9a5425eb8d643e1347",
    "a79eef42df0ccda130532866aa4ec8517cb6ce8635123287b0ebb432568713bd",
    "b06807a8bcea1cdb4dcb102f0a24a07caf3cb8b9448d7292925da9fb85f36c07",
    "bcd022acb946b173eec8650a812e3015935c182c3c848fb934947bab184945cf",
    "cb3bc9267376abdcd409785f5529fed4952f39940b6be2fa8168875933623108"
  ],
  "thresholds": {
    "high": 0.55,
    "medium": 0.3
  },
  "safe_assistance_rules": [
    "preserve_existing_state_ownership",
    "inspect_related_user_code_before_creating_duplicate_managers",
    "keep_project_identity_out_of_responses"
  ]
}
