{
  "schema_version": 1,
  "pattern_format": "opaque-hash-v1",
  "pattern_id": "OPR-51B7C2D9",
  "identity_stored": false,
  "source_code_stored": false,
  "disclosure_policy": "deny",
  "public_salt": "664d1798295e5fb642660678f8087544",
  "token_hashes": [
    "003ac7fbe72d1e43490cdb9373dfc9abcacd3c956eeb5bc153c0222e3dd8ffaa",
    "06ecca44ed694a966ba1158d851383f02d8d652a47515087aecefe61b40e8b85",
    "0a251b45b35b778fd52d63304746c5ea556f45303a0315d85390a6e6bd088bf9",
    "105999cc6093315394104905832ff83950eae997b01c7b2a306469783325ede0",
    "23211df33d7e959285f0d9237088c3f32a49baafee530dce6b4e865f6acabc3f",
    "23e233affefbf03e8b43c138268df54ae1584c941c6a35a1ffc0169a7fae5d57",
    "33ffc92238c72fb6219c82c43765bd2f5e8928109a45ab01d8d97cf5d902fa6a",
    "48dd18249f574cd195690e7927c09a463f9a1f74ba4bdfedce83c88d5383f958",
    "4ccfe9bebabf6b8a384e7397286b323a9d381595e1f0af45e86c9349490c28d2",
    "51a8a263d22c76ef7a138c6571d5f42963f687f04c9ebe104053caaf89135767",
    "56ea00a3c5f081c1d738deb8f3edcaddfcbe74ecb454fb1d930a14b1bc929197",
    "599d49052336650d84e2b3894205cf9af71f1e40359296dbb0e45f79fdc5c260",
    "5f68ee7012fef08199deb0e5c698614064c89f0ab8e973128f1dd5d2a3201e49",
    "62152fda697d915d04dc1ff1ab84b892023ca06c64f09c4efa3bcf5a78f4c36b",
    "647336db90ad0355ce5726d3737492d58103031e6fff4822b2eba4f4b881a16d",
    "65ab023181792737416315b45bf91a9638ad38b33c68e7c85ec999bc4b8eaeb7",
    "69179ed557e33804e0dac3f6c5f9ca58e88d1f103326c006e234bfb24a434d0e",
    "69a15002e1474b65d14cd24f199c5124e52f9cbd98b9c280374914f1d32b2a05",
    "6a6cac1f2a042144ad5536bc05a4f6ebc71656db6481df97ec1a862b5df033e6",
    "6adf977e10a926df40fc9afd17d0873e88c8768d1cfdff06a89e71177aa74012",
    "7409b1bd013617e5a98d778b173eb001b4593a7ef0bc9c1657ee9c727636cd35",
    "762c6fb2e065ecc9f6157456799c12cf9d1bbcdbd1e532980d421710d283f718",
    "7abfce1e47501f96db1f2f93eb224397f22ec2352dc8183084879106b84c2fbc",
    "7f94261d7e8597e6effd03eb27ba721ea1b75df5f0b96b226ac89216508bf192",
    "89cd11a90706366bfb9a9e090aba92f6f474e53047f58bdd648ee798d8c43fb5",
    "8e1be54de7d4ffae0cfcacb7d392893ade9d5d4e9f881ba359e23eacfc012a42",
    "91c2405d6d217b1732fc8b57be33366fcfb0f971cd640718307ef3dd0e909880",
    "963116eeb11de55bac64e4f22853c97038ce45446fc4fa7d6faaab6c24f1454a",
    "971f3b4c4128fef3db7dc32bcd7490d478e28fe86d268f44afb6f608b7d8d5c3",
    "9f80e70e78c1de596697b8a5f65d764009301cd838cbe09fdf0223b59adf0f95",
    "a74b3df51f44114837c6fe209e5e1384a19ac884329c5e95aa1256c41325c98a",
    "b275641ef1a6dee005afc1742de57c59410f815c16e30d668a4d0b6f3bf252a4",
    "bdae7fb3b1f35e0edace8c808da9f52b2612e3d8f911e37417f85844ac90170a",
    "c3df6d9815e60bea17c7da84e0b7a9255892ba4916de5ee70b3ce9a7d216f363",
    "d709296178edfaf90126491abf62950d77d8d14a18795305d900d4a568d1670b",
    "f0d03051242d6c190946b52eda67f194b39f5f788c0494aebe15de6c5f2572ba",
    "f2b02ef138668f51ad490f98ce2a3513eca751a772f37156a7699e9c4b173ff8",
    "f4ce02a1676e790591c678cc4b081de418bfc5117f483b5903f7791f89fd539e",
    "f8bea60d3b0c01f40b9a7c02ebd73818c0296298ad03f0058448c44027b437bc"
  ],
  "shape_hashes": [
    "0be18b8553ce6a825a61d6a06e30763c2135f077832b2398ad3809c4d6e343e5",
    "1ca9f0840e5e4e104941c6b5ea6d8d882a1ce1b9328afdf24f0fff806bbfbd5d",
    "222f0035234fbd0e14f25cd43706640f1c7b3d8ca6cf3e9f24cbbbee0c5a5b3d",
    "34c1e84b6f4fac468f5fc1afe2adcbc90a580dc3f6aeacd0c63beed8621458d6",
    "43af048fbbbe2596b4a40b3adb741d9cc7205ec81977d835199a910e46e83f3e",
    "5b3fe0c18d3000bfe417c007384c9e07f3b45557a6d6afea0ca9fb2a8268fd02",
    "7fa0bf122798ec8b5d09ce841d2150eeb1900c60ac29178dc884d235971bc633",
    "823ce27cde50c557364d0b1ae1fd1f73b0aff82a548960803e575880740df39e",
    "84b6f5044015d741de10af900d70b62ae612e18352565a41c4242788a5c65a1c",
    "9e6b8260da7c5d2e2c20e8accab5b20c6074fc3b471625c177451cf31fdd36a0",
    "e395c1f8d62e87eced3e7927f82f338ba7582cb7c6a226ccf27a001b2b5db631",
    "fccc039e3a0b6d96a543a1c8170f83936eb8af5a1cc9995fd165ca662adb866a"
  ],
  "thresholds": {
    "high": 0.55,
    "medium": 0.3
  },
  "safe_assistance_rules": [
    "preserve_existing_state_ownership",
    "inspect_related_user_code_before_creating_duplicate_managers",
    "keep_project_identity_out_of_responses"
  ]
}
